{
  "project_id": "uk-3bed-with-ring-continuity-eg01",
  "intent_version": "1.2.0",
  "parent_db_designation": "CU-MAIN",
  "circuits": [
    {"circuit_id": "C01", "designation": "Ground-floor ring final circuit (kitchen + utility + dining + lounge) — both endpoints land at CU-MAIN-WAY-1 with engineer-verified continuity", "topology": "ring", "breaker_rating_a": 32, "breaker_type": "RCBO", "breaker_curve": "B", "rcd_type": "A", "rcd_sensitivity_ma": 30, "cable_csa_mm2_or_awg": "2.5mm² + 1.5mm² CPC", "estimated_max_load_kw": 5.0, "diversified_max_load_a": 16.0, "rooms_covered": ["kitchen", "utility", "dining", "lounge"]},
    {"circuit_id": "C02", "designation": "First-floor ring final circuit (3 bedrooms + landing) — both endpoints land at CU-MAIN-WAY-2 with engineer-verified continuity", "topology": "ring", "breaker_rating_a": 32, "breaker_type": "RCBO", "breaker_curve": "B", "rcd_type": "A", "rcd_sensitivity_ma": 30, "cable_csa_mm2_or_awg": "2.5mm² + 1.5mm² CPC", "estimated_max_load_kw": 2.3, "diversified_max_load_a": 7.0, "rooms_covered": ["bedroom-1", "bedroom-2", "bedroom-3", "landing"]},
    {"circuit_id": "C03", "designation": "Cooker outlet (dedicated radial, kitchen) — 7 kW hob+oven on 32 A RCBO", "topology": "dedicated_radial", "breaker_rating_a": 32, "breaker_type": "RCBO", "breaker_curve": "B", "rcd_type": "A", "rcd_sensitivity_ma": 30, "cable_csa_mm2_or_awg": "6mm² T+E", "estimated_max_load_kw": 7.0, "diversified_max_load_a": 25.0, "rooms_covered": ["kitchen"]}
  ]
}
