{
  "project_id": "uk-3bed-with-cable-sizing-eg01",
  "intent_version": "1.0.0",
  "parent_db_designation": "CU-MAIN",
  "circuits": [
    {"circuit_id": "C01", "designation": "Ground-floor ring final circuit", "topology": "ring", "breaker_rating_a": 32, "breaker_type": "RCBO", "breaker_curve": "B", "rcd_type": "A", "rcd_sensitivity_ma": 30, "cable_csa_mm2_or_awg": "2.5mm² + 1.5mm² CPC", "estimated_max_load_kw": 5.5, "diversified_max_load_a": 16.0, "rooms_covered": ["kitchen", "utility", "dining", "lounge", "outdoor"]},
    {"circuit_id": "C02", "designation": "First-floor ring final circuit", "topology": "ring", "breaker_rating_a": 32, "breaker_type": "RCBO", "breaker_curve": "B", "rcd_type": "A", "rcd_sensitivity_ma": 30, "cable_csa_mm2_or_awg": "2.5mm² + 1.5mm² CPC", "estimated_max_load_kw": 2.0, "diversified_max_load_a": 6.5, "rooms_covered": ["bedroom-1", "bedroom-2", "bedroom-3"]},
    {"circuit_id": "C03", "designation": "Cooker outlet (dedicated radial)", "topology": "dedicated_radial", "breaker_rating_a": 32, "breaker_type": "RCBO", "breaker_curve": "B", "rcd_type": "A", "rcd_sensitivity_ma": 30, "cable_csa_mm2_or_awg": "6mm² T+E", "estimated_max_load_kw": 7.0, "diversified_max_load_a": 25.0, "rooms_covered": ["kitchen"]},
    {"circuit_id": "C04", "designation": "Immersion heater (dedicated radial)", "topology": "dedicated_radial", "breaker_rating_a": 16, "breaker_type": "RCBO", "breaker_curve": "B", "rcd_type": "A", "rcd_sensitivity_ma": 30, "cable_csa_mm2_or_awg": "2.5mm² T+E", "estimated_max_load_kw": 3.0, "diversified_max_load_a": 13.0, "rooms_covered": ["utility"]},
    {"circuit_id": "C05", "designation": "Bathroom shaver supply (BS EN 61558-2-5)", "topology": "dedicated_radial", "breaker_rating_a": 6, "breaker_type": "RCBO", "breaker_curve": "B", "rcd_type": "A", "rcd_sensitivity_ma": 30, "cable_csa_mm2_or_awg": "1.5mm² T+E", "estimated_max_load_kw": 0.5, "diversified_max_load_a": 2.2, "rooms_covered": ["bathroom"]}
  ]
}
