{
  "project_id": "us-residential-dwelling-eg01",
  "intent_version": "1.0.0",
  "parent_db_designation": "MAIN-PANEL",
  "circuits": [
    {"circuit_id": "C01", "designation": "Kitchen small appliance branch 1 (NEC 210.8(A)(6) + 210.12(B))", "topology": "radial", "breaker_rating_a": 20, "breaker_type": "AFCI_GFCI_dual", "breaker_curve": "C", "rcd_type": "GFCI", "rcd_sensitivity_ma": 10, "cable_csa_mm2_or_awg": "12 AWG", "estimated_max_load_kw": 2.5, "diversified_max_load_a": 12.0, "rooms_covered": ["kitchen"]},
    {"circuit_id": "C02", "designation": "Kitchen small appliance branch 2 (NEC 210.8(A)(6) + 210.12(B))", "topology": "radial", "breaker_rating_a": 20, "breaker_type": "AFCI_GFCI_dual", "breaker_curve": "C", "rcd_type": "GFCI", "rcd_sensitivity_ma": 10, "cable_csa_mm2_or_awg": "12 AWG", "estimated_max_load_kw": 2.0, "diversified_max_load_a": 10.0, "rooms_covered": ["kitchen"]},
    {"circuit_id": "C03", "designation": "General receptacles — living + bedrooms + hallway (NEC 210.12(A) AFCI)", "topology": "radial", "breaker_rating_a": 15, "breaker_type": "AFCI_breaker", "breaker_curve": "C", "cable_csa_mm2_or_awg": "14 AWG", "estimated_max_load_kw": 1.4, "diversified_max_load_a": 5.0, "rooms_covered": ["living-room", "bedroom-1", "bedroom-2", "hallway"]},
    {"circuit_id": "C04", "designation": "Bathroom GFCI (NEC 210.8(A)(1) + 210.11(C)(3))", "topology": "dedicated_radial", "breaker_rating_a": 20, "breaker_type": "GFCI_breaker", "breaker_curve": "C", "rcd_type": "GFCI", "rcd_sensitivity_ma": 10, "cable_csa_mm2_or_awg": "12 AWG", "estimated_max_load_kw": 0.8, "diversified_max_load_a": 3.5, "rooms_covered": ["bathroom"]},
    {"circuit_id": "C05", "designation": "Garage GFCI (NEC 210.8(A)(2))", "topology": "radial", "breaker_rating_a": 20, "breaker_type": "GFCI_breaker", "breaker_curve": "C", "rcd_type": "GFCI", "rcd_sensitivity_ma": 10, "cable_csa_mm2_or_awg": "12 AWG", "estimated_max_load_kw": 1.0, "diversified_max_load_a": 4.5, "rooms_covered": ["garage"]},
    {"circuit_id": "C06", "designation": "Outdoor GFCI (NEC 210.8(A)(3))", "topology": "radial", "breaker_rating_a": 20, "breaker_type": "GFCI_breaker", "breaker_curve": "C", "rcd_type": "GFCI", "rcd_sensitivity_ma": 10, "cable_csa_mm2_or_awg": "12 AWG", "estimated_max_load_kw": 0.5, "diversified_max_load_a": 2.0, "rooms_covered": ["outdoor"]},
    {"circuit_id": "C07", "designation": "Basement GFCI (NEC 210.8(A)(5))", "topology": "radial", "breaker_rating_a": 20, "breaker_type": "GFCI_breaker", "breaker_curve": "C", "rcd_type": "GFCI", "rcd_sensitivity_ma": 10, "cable_csa_mm2_or_awg": "12 AWG", "estimated_max_load_kw": 1.5, "diversified_max_load_a": 6.5, "rooms_covered": ["basement"]},
    {"circuit_id": "C08", "designation": "Laundry dedicated radial (NEC 210.11(C)(2) + 210.8(A)(10) GFCI)", "topology": "dedicated_radial", "breaker_rating_a": 20, "breaker_type": "GFCI_breaker", "breaker_curve": "C", "rcd_type": "GFCI", "rcd_sensitivity_ma": 10, "cable_csa_mm2_or_awg": "12 AWG", "estimated_max_load_kw": 1.5, "diversified_max_load_a": 6.5, "rooms_covered": ["laundry"]}
  ]
}
